{
  "client_id": "example-web-bff",
  "client_name": "Example Web BFF",
  "client_type": "confidential",
  "status": "draft",
  "grant_types": [
    "authorization_code",
    "refresh_token"
  ],
  "redirect_uris": [
    "https://example-client.invalid/oauth/callback"
  ],
  "token_endpoint_auth_method": "client_secret_basic",
  "allowed_resources": [
    "https://example-resource.invalid/api"
  ],
  "allowed_scopes": [
    "example-project:records:read"
  ],
  "owner": {
    "team": "example-owner",
    "contact": null
  },
  "credential_lifecycle": {
    "secret_present": true,
    "rotated_at": null,
    "expires_at": null
  },
  "created_at": "2026-08-25T00:00:00Z",
  "updated_at": "2026-08-25T00:00:00Z"
}
